{
  "schema": "D274_03_SECOND_CYCLE_EVIDENCE_V1",
  "capture_sha256": "5f11d06763d34531c72283a189a47d9bcd7c666a5fa3c043ec1371eddf107998",
  "target_vid": "27c6",
  "target_pid": "5125",
  "firmware_identity_status": "TARGET_CAPTURE_OBSERVED_APP12509",
  "workflow_class": "WINDOWS_HELLO_SETUP_CANDIDATE_NO_COMMIT",
  "boundary_status": "OBSERVED_COMPLETE",
  "rearm_0x32_frame": {
    "frame": 238,
    "direction": "host_to_device",
    "outer_wrapper": "0xa0",
    "physical_length": 64,
    "declared_outer_length": 24,
    "relative_timestamp_ms": 137926.415,
    "event_class": "REARM_0X32",
    "control": 50
  },
  "rearm_0x32_ack_frame": {
    "frame": 241,
    "direction": "device_to_host",
    "outer_wrapper": "0xa0",
    "physical_length": 10,
    "declared_outer_length": 10,
    "relative_timestamp_ms": 137936.908,
    "event_class": "ACK_0X32_STATUS_0X01",
    "ack_echo": 50,
    "ack_status": 1
  },
  "second_irq2_frame": {
    "frame": 243,
    "direction": "device_to_host",
    "outer_wrapper": "0xa0",
    "physical_length": 24,
    "declared_outer_length": 24,
    "relative_timestamp_ms": 173878.783,
    "event_class": "IRQ_0X0002",
    "irq_code": 2
  },
  "second_0x22_frame": {
    "frame": 244,
    "direction": "host_to_device",
    "outer_wrapper": "0xa0",
    "physical_length": 64,
    "declared_outer_length": 10,
    "relative_timestamp_ms": 173880.225,
    "event_class": "WIRE_0X22",
    "control": 34
  },
  "second_0x22_ack_frame": {
    "frame": 247,
    "direction": "device_to_host",
    "outer_wrapper": "0xa0",
    "physical_length": 10,
    "declared_outer_length": 10,
    "relative_timestamp_ms": 173881.347,
    "event_class": "ACK_0X22_STATUS_0X01",
    "ack_echo": 34,
    "ack_status": 1
  },
  "second_b0_frame": {
    "frame": 249,
    "direction": "device_to_host",
    "outer_wrapper": "0xb0",
    "physical_length": 7726,
    "declared_outer_length": 7726,
    "relative_timestamp_ms": 173928.596,
    "event_class": "FINGERPRINT_B0",
    "declared_b0_length": 7722,
    "tls_record_type_class": "TLS_APPLICATION_DATA"
  },
  "third_cycle_observed": false,
  "stop_reason": "SECOND_FINGERPRINT_B0",
  "failure_class": null,
  "host_capture_deadline_seconds": 180,
  "host_deadline_policy": "EVIDENCE_BOUNDED_NOT_DEVICE_TIMEOUT_CLAIM",
  "device_timeout_claim": "UNKNOWN",
  "timing_observations_ms": {
    "rearm_0x32": 137926.415,
    "rearm_0x32_ack": 137936.908,
    "second_irq2": 173878.783,
    "second_0x22": 173880.225,
    "second_0x22_ack": 173881.347,
    "second_b0": 173928.596,
    "delta_rearm_0x32_to_rearm_0x32_ack": 10.493,
    "delta_rearm_0x32_ack_to_second_irq2": 35941.875,
    "delta_second_irq2_to_second_0x22": 1.442,
    "delta_second_0x22_to_second_0x22_ack": 1.122,
    "delta_second_0x22_ack_to_second_b0": 47.249
  },
  "counts": {
    "irq0002": 2,
    "wire_0x22": 2,
    "fingerprint_b0": 5
  },
  "privacy_payload_exported": false,
  "biometric_plaintext_exported": false,
  "biometric_hash_exported": false,
  "secret_material_exported": false,
  "pin_value_exported": false
}
